{
  "$schema": "https://json-schema.org/draft/2020-12/schema",
  "$id": "challenge.schema.json",
  "title": "Challenge",
  "description": "A generic skill challenge: one or a handful of DC'd checks with no persistent point pool/tracking (see subsystem.schema.json for that — Victory Points, Chases, Infiltration, etc.). Fits any one-off skill gauntlet. Structured with explicit DCs and skills so a future probability calculator can estimate the party's odds per check (see reference/tables/dc-and-check-math.json for the underlying degree-of-success math).",
  "type": "object",
  "required": ["id", "type", "name", "checks", "authoring"],
  "properties": {
    "$schema": { "type": "string" },
    "id": { "type": "string" },
    "type": { "const": "challenge" },
    "authoring": { "$ref": "common/authoring.schema.json#/$defs/authoring" },
    "name": { "type": "string" },
    "description": { "type": "string", "description": "Narrative framing — what this challenge represents in-fiction." },
    "levelContext": { "type": ["integer", "null"], "description": "The level this challenge's DCs are pitched at. DCs come from the task, never from an enemy's level." },
    "checks": {
      "type": "array",
      "minItems": 1,
      "items": { "$ref": "common/sf2e-common.schema.json#/$defs/check" }
    },
    "resolutionMode": {
      "enum": ["any-one-success", "all-must-succeed", "cumulative-count", "narrative-only"],
      "description": "How the individual checks combine into an overall outcome. cumulative-count = GM tallies successes/failures narratively without a formal point pool."
    },
    "successThreshold": { "type": ["integer", "null"], "description": "For cumulative-count: how many checks need to succeed." },
    "outcomes": { "$ref": "common/sf2e-common.schema.json#/$defs/degreeOfSuccessOutcome", "description": "Overall challenge outcome text, if resolutionMode isn't per-check." },
    "participants": { "type": "array", "items": { "type": "string" }, "description": "id refs of kids/Frames who can attempt this, or a free-text description (e.g. \"Any of the six\")." },
    "relatedRefs": { "type": "array", "items": { "type": "string" }, "description": "e.g. an episode/scene id this challenge belongs to." },
    "notes": { "type": "string" }
  }
}
