{
  "$schema": "../schema/challenge.schema.json",
  "id": "c1e1-assembly",
  "type": "challenge",
  "authoring": {
    "status": "drafted"
  },
  "name": "Assembly",
  "description": "Three optional checks around the ceremony. None of them costs anything mechanical.",
  "levelContext": 1,
  "checks": [
    {
      "id": "the-anthem",
      "name": "Get through the anthem",
      "skillOptions": [
        "performance",
        "deception"
      ],
      "dc": {
        "value": 13,
        "basis": "level 1, one step easy",
        "adjustment": "easy"
      },
      "outcomes": {
        "criticalSuccess": "They carry it off so well that an officer on the platform nods at them.",
        "success": "Nobody notices a thing.",
        "failure": "A neighbour notices they don't know the words and asks, kindly, where they're from.",
        "criticalFailure": "They're loudly wrong exactly where the piano stops. Somebody on the platform makes a note."
      },
      "repeatable": false
    },
    {
      "id": "read-the-room",
      "name": "Read the platform",
      "skillOptions": [
        "perception",
        "society"
      ],
      "dc": {
        "value": 15,
        "basis": "level 1, no adjustment",
        "adjustment": "none"
      },
      "insight": true,
      "outcomes": {
        "criticalSuccess": "The shape of the place: machines, radio, medical, stores. And one officer at the far end whom nobody on the platform has looked at once.",
        "success": "About a dozen departments: who runs the machines, the radio and medical. The doctor from this morning is up there.",
        "failure": "Too many uniforms to keep straight.",
        "criticalFailure": "They're sure the woman with horns runs the whole base."
      },
      "repeatable": false
    },
    {
      "id": "the-charter",
      "name": "Read the signatures",
      "skillOptions": [
        "society",
        "perception"
      ],
      "dc": {
        "value": 15,
        "basis": "level 1, no adjustment",
        "adjustment": "none"
      },
      "insight": true,
      "outcomes": {
        "criticalSuccess": "As success, and they would know the doctor's scrawl again anywhere.",
        "success": "Four signatures: a flowing hand; a quick doctor's scrawl; HYUCK in capitals, pressed so hard the nib tore the paper; and small careful characters in a script nobody here reads.",
        "failure": "It's a charter. It says what charters say.",
        "criticalFailure": "A staffer tells them confidently that the original burned and this is a copy. It isn't."
      },
      "repeatable": false
    }
  ],
  "resolutionMode": "narrative-only",
  "participants": [
    "Any of the six"
  ],
  "relatedRefs": [
    "episode-c1e1-mothers-maiden-name",
    "episode-c1e1--assembly"
  ],
  "notes": "No check gates the scene."
}
